{
  "$schema": "https://json-schema.org/draft/2020-12/schema",
  "$id": "https://conveyor.dev/schemas/conveyor.resource_ref@1.json",
  "title": "Conveyor ResourceRef",
  "type": "object",
  "additionalProperties": false,
  "required": ["schema_version", "kind", "id_or_key"],
  "properties": {
    "schema_version": { "const": "conveyor.resource_ref@1" },
    "kind": { "type": "string", "minLength": 1 },
    "id_or_key": { "type": "string", "minLength": 1 },
    "version": { "type": "string", "minLength": 1 },
    "digest": { "$ref": "#/$defs/digest_ref" },
    "project_id": { "type": "string", "minLength": 1 },
    "trust_domain_id": { "type": "string", "minLength": 1 }
  },
  "$defs": {
    "digest_ref": {
      "type": "object",
      "additionalProperties": false,
      "required": ["schema_version", "algorithm", "value"],
      "properties": {
        "schema_version": { "const": "conveyor.digest_ref@1" },
        "algorithm": { "enum": ["sha256", "sha512", "blake3"] },
        "value": { "type": "string", "pattern": "^[0-9a-f]{64,128}$" }
      }
    }
  }
}
